{
    "first_name": "Roy",
    "last_name": "Peter",
    "id": "123456789",
    "email": "royp@gmail.com",
    "age": 19,
    "father_details": {
        "first_name": "Yaron"
    },
    "mother_details": {
        "last_name": "Tamara"
    }, 
    "city_of_residence": "Tel-Aviv yafo",
    "zip_code": "6931234",
    "does_have_pet": false,
    "number_of_siblings": 2,
    "favorite_book": "The Wizard Of Oz",
    "favorite_color": "Pink",
    "hobbies": [
        "reading",
        "running",
        "programming"
    ],
    "nationality": "Israeli",
    "religion": "Judaism",
    "favorite_singer": "Elton John",
    "favorite_tv_show": "Fauda",
    "country_of_birth": "Zimbabwe",
    "likes_coffee": true,
    "yanny_or_laurel": "yanny",
    "is_vegan": false,
    "phone_number_optional": "054-1234567"
}