{
    "first_name": "Abraham",
    "last_name": "Avino",
    "id": "987654321",
    "email": "abr@bible.com",
    "age": 97,
    "father_details": {
        "first_name": "Kayn"
    },
    "mother_details": {
        "last_name": "Hevel"
    }, 
    "city_of_residence": "Or Kasdim",
    "zip_code": "4567891",
    "does_have_pet": true,
    "number_of_siblings": 0,
    "favorite_book": "The bible",
    "favorite_color": "Pink",
    "hobbies": [
        "reading"
    ],
    "nationality": "Israeli",
    "religion": "Judaism",
    "favorite_singer": "Hava",
    "favorite_tv_show": "Rockstats",
    "country_of_birth": "Syria",
    "likes_coffee": true,
    "yanny_or_laurel": "yanny",
    "is_vegan": false
}